{
  "apiVersion": "marshal.dev/v1alpha1",
  "kind": "RunState",
  "taskId": "REVIEW-FRESHNESS-FIXTURE",
  "runId": "review-freshness-fixture-r1",
  "state": "REVIEW_PENDING",
  "sequence": 8,
  "specDigest": "sha256:1111111111111111111111111111111111111111111111111111111111111111",
  "policyDigest": "sha256:2222222222222222222222222222222222222222222222222222222222222222",
  "capabilityDigest": "sha256:3333333333333333333333333333333333333333333333333333333333333333",
  "baseSha": "aaaaaaaaaaaaaaaaaaaaaaaaaaaaaaaaaaaaaaaa",
  "currentAttemptId": "attempt:fixture-01",
  "reviewRound": 2,
  "attemptsUsed": 1,
  "operationalRetriesUsed": 0,
  "reworkRoundsUsed": 1,
  "createdAt": "2026-08-20T00:00:00Z",
  "updatedAt": "2026-08-20T00:02:00Z"
}
