{
  "apiVersion": "marshal.dev/v1alpha1",
  "kind": "RunState",
  "taskId": "TASK-closure",
  "runId": "run-closure-01",
  "state": "REVIEW_PENDING",
  "sequence": 12,
  "specDigest": "sha256:1111111111111111111111111111111111111111111111111111111111111111",
  "baseSha": "0000000000000000000000000000000000000000",
  "currentAttemptId": "attempt-02",
  "reviewRound": 2,
  "attemptsUsed": 2,
  "operationalRetriesUsed": 0,
  "reworkRoundsUsed": 1,
  "createdAt": "2026-08-20T00:00:00Z",
  "updatedAt": "2026-08-20T00:00:02Z"
}
